{
  "lesson_number": "Lesson 1",
  "lesson_title": "Finding Myself",
  "level_name": "Level 3",
  "cefr_level": "CEFR A1",
  "article_type": "fiction",
  "genre": "Young Adult Fiction",
  "vocabulary": [
    {
      "word": "invisible",
      "phonetic": "",
      "definition": "not able to be seen"
    },
    {
      "word": "amazing",
      "phonetic": "",
      "definition": "causing great surprise or wonder"
    },
    {
      "word": "encouraged",
      "phonetic": "",
      "definition": "gave support or confidence to someone"
    },
    {
      "word": "talent",
      "phonetic": "",
      "definition": "natural ability to do something well"
    },
    {
      "word": "brave",
      "phonetic": "",
      "definition": "showing courage"
    }
  ],
  "article_image_url": "https://storage.googleapis.com/artifacts.reading-advantage.appspot.com/images/PfzjAu0eSyuUokFK2rnk.png",
  "article_caption": "Lily, a quiet girl, discovers her identity through art and finds the courage to share her voice in a city art contest.",
  "article_url": "https://app.reading-advantage.com/th/student/read/PfzjAu0eSyuUokFK2rnk",
  "article_paragraphs": [
    {
      "number": 1,
      "text": "Lily was a quiet girl. She lived in a small town. Every day, she went to school and sat in the back of the class. She liked to draw. Her drawings were beautiful, but no one saw them. Lily felt invisible. She wanted to be seen. One day, her art teacher, Mr. Green, noticed her drawings. He said, \"Lily, your art is amazing! You should show it to others.\" Lily felt shy. She did not want to show her work. But Mr. Green encouraged her. He said, \"You have talent. Share it with the world.\" Lily thought about his words. She wanted to be brave. She wanted to find her voice. That night, she decided to enter an art contest. The contest was in the big city. It was a big step for her. The next day, Lily told her best friend, Mia."
    },
    {
      "number": 2,
      "text": "Mia was excited. \"You can do it!\" she said. \"I will help you!\" They spent hours working on Lily's piece. They laughed and talked. Mia made Lily feel strong. As the contest day came closer, Lily felt nervous. What if people did not like her art? What if she failed? But Mia reminded her, \"It is not about winning. It is about sharing your story.\" Finally, the day of the contest arrived. Lily and Mia took the bus to the city. The city was big and loud. Lily felt small. They reached the gallery. It was beautiful. Many people were there. Lily's heart raced. When it was time to show her art, Lily stood in front of her painting. It was a picture of a girl standing on a hill."
    },
    {
      "number": 3,
      "text": "The girl looked at the sunset. The colors were bright and warm. Lily felt proud. She took a deep breath and spoke. \"This is me. I feel lost sometimes, but I am finding my way.\" People listened. They smiled. Some even cried. Lily felt a wave of happiness. She was not invisible anymore. She was seen. After the contest, Lily did not win first place, but she won something more important. She found her voice. She found her identity. She learned that sharing her art was a way to share herself. From that day on, Lily was no longer just a quiet girl. She was an artist. She was Lily, and she was proud of who she was."
    }
  ],
  "comprehension_questions": [
    {
      "number": 1,
      "question": "What did Lily learn after the contest?",
      "options": [
        "She found her voice.",
        "She should stop drawing.",
        "She is not an artist.",
        "She should move to another city."
      ]
    },
    {
      "number": 2,
      "question": "What is Lily's favorite activity?",
      "options": [
        "Drawing",
        "Singing",
        "Dancing",
        "Reading"
      ]
    },
    {
      "number": 3,
      "question": "What did Lily say about her painting?",
      "options": [
        "This is me.",
        "This is my friend.",
        "This is my house.",
        "This is my cat."
      ]
    },
    {
      "number": 4,
      "question": "Who helped Lily with her art piece?",
      "options": [
        "Mia",
        "Anna",
        "Sara",
        "Emma"
      ]
    }
  ],
  "short_answer_question": "What does Lily like to do?",
  "sentence_starters": [
    "Lily likes...",
    "I think...",
    "The article says..."
  ],
  "vocab_match": [
    {
      "number": 1,
      "word": "invisible",
      "letter": "a",
      "definition": "showing courage"
    },
    {
      "number": 2,
      "word": "amazing",
      "letter": "b",
      "definition": "gave support or confidence to someone"
    },
    {
      "number": 3,
      "word": "encouraged",
      "letter": "c",
      "definition": "causing great surprise or wonder"
    },
    {
      "number": 4,
      "word": "talent",
      "letter": "d",
      "definition": "not able to be seen"
    },
    {
      "number": 5,
      "word": "brave",
      "letter": "e",
      "definition": "natural ability to do something well"
    }
  ],
  "vocab_fill": [
    {
      "number": 1,
      "sentence": "Lily felt <span class=\"blank\"></span>."
    },
    {
      "number": 2,
      "sentence": "He said, \"Lily, your art is <span class=\"blank\"></span>."
    },
    {
      "number": 3,
      "sentence": "Green <span class=\"blank\"></span> her."
    },
    {
      "number": 4,
      "sentence": "He said, \"You have <span class=\"blank\"></span>."
    }
  ],
  "vocab_word_bank": [
    "invisible",
    "amazing",
    "encouraged",
    "talent",
    "brave"
  ],
  "sentence_order_questions": [
    {
      "words": [
        "a",
        "Lily",
        "was",
        "girl",
        "quiet"
      ]
    },
    {
      "words": [
        "Mia",
        "was",
        "excited"
      ]
    }
  ],
  "sentence_completion_prompts": [
    {
      "number": 1,
      "prompt": "Lily was a"
    },
    {
      "number": 2,
      "prompt": "\"You can do"
    },
    {
      "number": 3,
      "prompt": "Lily felt proud"
    }
  ],
  "writing_prompt": "Describe Lily's feelings when she decided to enter the art contest. Why did she feel this way? Use simple connectors like 'and', 'but', and 'because' in your answer.",
  "mc_answers": [
    {
      "number": 1,
      "letter": "a",
      "text": "She found her voice."
    },
    {
      "number": 2,
      "letter": "a",
      "text": "Drawing"
    },
    {
      "number": 3,
      "letter": "a",
      "text": "This is me."
    },
    {
      "number": 4,
      "letter": "a",
      "text": "Mia"
    }
  ],
  "vocab_match_answer_string": "1-d, 2-c, 3-b, 4-e, 5-a",
  "vocab_fill_answer_string": "1. invisible, 2. amazing, 3. encouraged, 4. talent",
  "sentence_order_answers": [
    {
      "number": 1,
      "sentence": "Lily was a quiet girl."
    },
    {
      "number": 2,
      "sentence": "Mia was excited."
    }
  ],
  "translation_paragraphs": [
    {
      "label": "Paragraph 1",
      "text": "ลิลลี่เป็นเด็กผู้หญิงที่เงียบๆ เธออาศัยอยู่ในเมืองเล็กๆ ทุกวันเธอไปโรงเรียนและนั่งอยู่หลังห้อง เธอชอบวาดรูป ภาพวาดของเธอสวยงาม แต่ไม่มีใครเห็น ลิลลี่รู้สึกเหมือนมองไม่เห็น เธอต้องการให้คนเห็น วันหนึ่ง ครูสอนศิลปะของเธอ คุณกรีน สังเกตเห็นภาพวาดของเธอ เขาพูดว่า \"ลิลลี่ ศิลปะของเธอสวยงามมาก! เธอควรแสดงให้คนอื่นดู\" ลิลลี่รู้สึกอาย เธอไม่อยากแสดงผลงานของเธอ แต่คุณกรีนให้กำลังใจเธอ เขาพูดว่า \"เธอมีพรสวรรค์ แบ่งปันให้โลกได้รับรู้\" ลิลลี่คิดถึงคำพูดของเขา เธออยากจะกล้าหาญ เธอต้องการค้นหาเสียงของตัวเอง คืนนั้นเธอตัดสินใจเข้าร่วมการประกวดศิลปะ การประกวดจัดขึ้นในเมืองใหญ่ มันเป็นก้าวสำคัญสำหรับเธอ วันรุ่งขึ้น ลิลี่เล่าให้มีอาเพื่อนสนิทของเธอฟัง"
    },
    {
      "label": "Paragraph 2",
      "text": "มีอาตื่นเต้น เธอพูดว่า \"เธอทำได้!\" \"ฉันจะช่วยเธอเอง!\" พวกเขาใช้เวลาหลายชั่วโมงในการทำงานชิ้นงานของลิลี่ พวกเขาหัวเราะและพูดคุยกัน มีอาทำให้ลิลี่รู้สึกเข้มแข็ง เมื่อวันประกวดใกล้เข้ามา ลิลี่รู้สึกประหม่า ถ้าผู้คนไม่ชอบงานศิลปะของเธอจะทำอย่างไร ถ้าเธอทำไม่สำเร็จล่ะ แต่มีเตือนเธอว่า \"มันไม่ใช่เรื่องของการชนะ มันคือเรื่องของการแบ่งปันเรื่องราวของเธอ\" ในที่สุด วันประกวดก็มาถึง ลิลี่และมีอานั่งรถประจำทางไปในเมือง เมืองใหญ่และเสียงดัง ลิลี่รู้สึกตัวเล็ก พวกเขาไปถึงหอศิลป์ มันสวยงามมาก มีผู้คนมากมายอยู่ที่นั่น หัวใจของลิลี่เต้นแรง เมื่อถึงเวลาแสดงงานศิลปะของเธอ ลิลลี่ก็ยืนอยู่หน้าภาพวาดของเธอ มันเป็นรูปภาพของเด็กผู้หญิงคนหนึ่งยืนอยู่บนเนินเขา"
    },
    {
      "label": "Paragraph 3",
      "text": "เด็กผู้หญิงมองไปที่พระอาทิตย์ตกดิน สีสันสดใสและอบอุ่น ลิลลี่รู้สึกภูมิใจ เธอสูดหายใจเข้าลึกๆ และพูด “นี่คือฉัน บางครั้งฉันรู้สึกหลงทาง แต่ฉันกำลังค้นหาเส้นทางของตัวเอง” ผู้คนตั้งใจฟัง พวกเขายิ้ม บางคนถึงกับร้องไห้ ลิลลี่รู้สึกถึงความสุขอย่างท่วมท้น เธอไม่ได้ล่องหนอีกต่อไป เธอถูกมองเห็น หลังจากการประกวด ลิลลี่ไม่ได้รางวัลที่หนึ่ง แต่เธอได้รับสิ่งที่สำคัญกว่า เธอพบเสียงของตัวเอง เธอพบบุคลิกของตัวเอง เธอเรียนรู้ว่าการแบ่งปันงานศิลปะของเธอเป็นวิธีแบ่งปันตัวเธอเอง ตั้งแต่วันนั้นเป็นต้นมา ลิลลี่ไม่ใช่แค่เด็กผู้หญิงเงียบๆ อีกต่อไป เธอเป็นศิลปิน เธอคือลิลลี่ และเธอภูมิใจในสิ่งที่เธอเป็น"
    }
  ]
}