{
  "lesson_number": "Lesson 1",
  "lesson_title": "Test Lesson",
  "level_name": "Origins",
  "cefr_level": "A1",
  "article_type": "Informational",
  "genre": "Science",
  "vocabulary": [
    {
      "word": "test",
      "definition": "a procedure to assess knowledge",
      "phonetic": "/test/"
    },
    {
      "word": "learn",
      "definition": "to acquire knowledge",
      "phonetic": "/lɜːrn/"
    }
  ],
  "article_image_url": "images/article-image-1769942126759.jpg",
  "article_caption": "Test image caption",
  "article_url": "https://example.com/article",
  "article_paragraphs": [
    {
      "number": 1,
      "text": "This is the first paragraph of the test article."
    },
    {
      "number": 2,
      "text": "This is the second paragraph with more content."
    }
  ],
  "comprehension_questions": [
    {
      "number": 1,
      "question": "What is this article about?",
      "options": [
        "Testing",
        "Learning",
        "Both",
        "Neither"
      ]
    },
    {
      "number": 2,
      "question": "How many paragraphs are there?",
      "options": [
        "One",
        "Two",
        "Three",
        "Four"
      ]
    }
  ],
  "short_answer_question": "What did you learn from this article?",
  "sentence_starters": [
    "I learned that...",
    "The article explains..."
  ],
  "writing_prompt": "Write about what you learned in this lesson."
}