{
  "lesson_number": "Lesson 1",
  "lesson_title": "The Amazing Human Body",
  "level_name": "Level 3",
  "cefr_level": "CEFR A1",
  "article_type": "nonfiction",
  "genre": "Children's Nonfiction",
  "vocabulary": [
    {
      "word": "curious",
      "phonetic": "",
      "definition": "eager to know or learn something"
    },
    {
      "word": "muscle",
      "phonetic": "",
      "definition": "a tissue in the body that can contract to produce movement"
    },
    {
      "word": "oxygen",
      "phonetic": "",
      "definition": "a gas that is essential for life and is needed by living things to breathe"
    },
    {
      "word": "digest",
      "phonetic": "",
      "definition": "to break down food in the body so that it can be used for energy"
    },
    {
      "word": "flexed",
      "phonetic": "",
      "definition": "to bend a muscle or joint"
    }
  ],
  "article_image_url": "https://storage.googleapis.com/artifacts.reading-advantage.appspot.com/images/rY1QKnciUBBhE9MyadbF.png",
  "article_caption": "Mia discovers the amazing functions of the human body, learning about the brain, heart, lungs, stomach, muscles, bones, skin, and senses.",
  "article_url": "https://app.reading-advantage.com/th/student/read/rY1QKnciUBBhE9MyadbF",
  "article_paragraphs": [
    {
      "number": 1,
      "text": "Once upon a time, in a small town, there lived a curious girl named Mia. Mia loved to learn about the world around her. One day, she found a book about the human body. She was excited! She wanted to know how her body worked. Mia opened the book. The first page showed a big picture of the human body. It had many parts. There were the head, arms, legs, and feet. Mia learned that the head holds the brain. The brain is very important. It helps us think and learn. Next, Mia read about the heart. The heart is a muscle. It pumps blood all over the body. Blood carries oxygen and food to every part. Mia put her hand on her chest. She could feel her heart beating. \"Thump, thump!\" it went. Mia turned the page. She saw a picture of the lungs."
    },
    {
      "number": 2,
      "text": "The lungs help us breathe. When we breathe in, we take in air. When we breathe out, we let air go. Mia took a deep breath. She felt her lungs fill with air. Then, Mia learned about the stomach. The stomach helps digest food. When we eat, food goes to the stomach. The stomach breaks it down. This helps our body get energy. Mia thought about her favorite food, pizza. She loved pizza! Mia continued reading. She found out about muscles and bones. Muscles help us move. Bones give our body shape. Mia flexed her arm. She could feel her muscles working. She jumped up and down. Her bones were strong! Mia was amazed by the skin."
    },
    {
      "number": 3,
      "text": "Skin covers our body. It protects us from the outside. It keeps us safe. Mia touched her arm. She felt her skin. It was soft and warm. Finally, Mia learned about the senses. We have five senses: sight, hearing, taste, touch, and smell. These senses help us understand the world. Mia looked around. She saw the trees and heard the birds. She smiled. Mia closed the book. She felt happy. She learned so much about her body. The human body is amazing! It works every day without us thinking. Mia decided to tell her friends about what she learned. They would love to know about the human body too!"
    }
  ],
  "comprehension_questions": [
    {
      "number": 1,
      "question": "What does the heart do?",
      "options": [
        "Pumps blood",
        "Helps us breathe",
        "Digests food",
        "Gives shape to the body"
      ]
    },
    {
      "number": 2,
      "question": "What covers our body?",
      "options": [
        "Skin",
        "Muscles",
        "Bones",
        "Lungs"
      ]
    },
    {
      "number": 3,
      "question": "What did Mia decide to do at the end?",
      "options": [
        "Tell her friends about the human body",
        "Close the book",
        "Go to sleep",
        "Draw a picture"
      ]
    },
    {
      "number": 4,
      "question": "What is the name of the girl in the story?",
      "options": [
        "Mia",
        "Sara",
        "Lily",
        "Anna"
      ]
    }
  ],
  "short_answer_question": "What does the heart do?",
  "sentence_starters": [
    "The heart...",
    "I think...",
    "The article says..."
  ],
  "vocab_match": [
    {
      "number": 1,
      "word": "curious",
      "letter": "a",
      "definition": "eager to know or learn something"
    },
    {
      "number": 2,
      "word": "muscle",
      "letter": "b",
      "definition": "to bend a muscle or joint"
    },
    {
      "number": 3,
      "word": "oxygen",
      "letter": "c",
      "definition": "to break down food in the body so that it can be used for energy"
    },
    {
      "number": 4,
      "word": "digest",
      "letter": "d",
      "definition": "a tissue in the body that can contract to produce movement"
    },
    {
      "number": 5,
      "word": "flexed",
      "letter": "e",
      "definition": "a gas that is essential for life and is needed by living things to breathe"
    }
  ],
  "vocab_fill": [
    {
      "number": 1,
      "sentence": "Once upon a time, in a small town, there lived a <span class=\"blank\"></span> girl named Mia."
    },
    {
      "number": 2,
      "sentence": "The heart is a <span class=\"blank\"></span>."
    },
    {
      "number": 3,
      "sentence": "Blood carries <span class=\"blank\"></span> and food to every part."
    },
    {
      "number": 4,
      "sentence": "The stomach helps <span class=\"blank\"></span> food."
    }
  ],
  "vocab_word_bank": [
    "curious",
    "muscle",
    "oxygen",
    "digest",
    "flexed"
  ],
  "sentence_order_questions": [
    {
      "words": [
        "lived",
        "there",
        "time,",
        "town,",
        "a",
        "upon",
        "in",
        "small",
        "a",
        "Once"
      ]
    },
    {
      "words": [
        "us",
        "breathe",
        "help",
        "lungs",
        "The"
      ]
    }
  ],
  "sentence_completion_prompts": [
    {
      "number": 1,
      "prompt": "Once upon a time, in a small"
    },
    {
      "number": 2,
      "prompt": "When we breathe in,"
    },
    {
      "number": 3,
      "prompt": "It keeps us"
    }
  ],
  "writing_prompt": "What did Mia learn about the brain? Describe why the brain is important and how it helps us.",
  "mc_answers": [
    {
      "number": 1,
      "letter": "a",
      "text": "Pumps blood"
    },
    {
      "number": 2,
      "letter": "a",
      "text": "Skin"
    },
    {
      "number": 3,
      "letter": "a",
      "text": "Tell her friends about the human body"
    },
    {
      "number": 4,
      "letter": "a",
      "text": "Mia"
    }
  ],
  "vocab_match_answer_string": "1-a, 2-d, 3-e, 4-c, 5-b",
  "vocab_fill_answer_string": "1. curious, 2. muscle, 3. oxygen, 4. digest",
  "sentence_order_answers": [
    {
      "number": 1,
      "sentence": "Once upon a time, in a small town, there lived."
    },
    {
      "number": 2,
      "sentence": "The lungs help us breathe."
    }
  ],
  "translation_paragraphs": [
    {
      "label": "Paragraph 1",
      "text": "กาลครั้งหนึ่งนานมาแล้ว ในเมืองเล็กๆ แห่งหนึ่ง มีเด็กหญิงขี้สงสัยชื่อเมอาอาศัยอยู่ เมอาชอบเรียนรู้เกี่ยวกับโลกรอบตัวเธอ วันหนึ่ง เธอพบหนังสือเกี่ยวกับร่างกายมนุษย์ เธอรู้สึกตื่นเต้น! เธออยากรู้ว่าร่างกายของเธอทำงานอย่างไร เมอาเปิดหนังสือ หน้าแรกแสดงภาพขนาดใหญ่ของร่างกายมนุษย์ มันมีหลายส่วน มีศีรษะ แขน ขา และเท้า เมอาเรียนรู้ว่าศีรษะมีสมอง สมองมีความสำคัญมาก มันช่วยให้เราคิดและเรียนรู้ ต่อไป เมอาอ่านเกี่ยวกับหัวใจ หัวใจเป็นกล้ามเนื้อ มันสูบฉีดเลือดไปทั่วร่างกาย เลือดนำพาออกซิเจนและอาหารไปยังทุกส่วน เมอาเอามือแตะหน้าอก เธอรู้สึกถึงหัวใจเต้น \"ตุบ ตุบ!\" มันดังขึ้น เมอาเปิดหน้าต่อไป เธอเห็นรูปภาพของปอด"
    },
    {
      "label": "Paragraph 2",
      "text": "ปอดช่วยให้เราหายใจ เมื่อเราหายใจเข้า เรานำอากาศเข้าไป เมื่อเราหายใจออก เราปล่อยอากาศออกไป เมียหายใจเข้าลึกๆ เธอรู้สึกว่าปอดของเธอเต็มไปด้วยอากาศ จากนั้น เมียก็ได้เรียนรู้เกี่ยวกับกระเพาะอาหาร กระเพาะอาหารช่วยย่อยอาหาร เมื่อเรากินอาหาร อาหารจะไปที่กระเพาะอาหาร กระเพาะอาหารจะย่อยมัน สิ่งนี้ช่วยให้ร่างกายของเราได้รับพลังงาน เมียนึกถึงอาหารจานโปรดของเธอ พิซซ่า เธอรักพิซซ่า! เมียอ่านต่อไป เธอค้นพบเกี่ยวกับกล้ามเนื้อและกระดูก กล้ามเนื้อช่วยให้เราเคลื่อนไหว กระดูกทำให้ร่างกายของเรามีรูปร่าง เมียเกร็งแขน เธอรู้สึกได้ถึงการทำงานของกล้ามเนื้อ เธอกระโดดขึ้นลง กระดูกของเธอแข็งแรง! เมียรู้สึกทึ่งกับผิวหนัง"
    },
    {
      "label": "Paragraph 3",
      "text": "ผิวหนังปกคลุมร่างกายของเรา มันปกป้องเราจากภายนอก มันทำให้เราปลอดภัย เมียแตะแขนของเธอ เธอรู้สึกถึงผิวของเธอ มันนุ่มและอบอุ่น ในที่สุด เมียก็ได้เรียนรู้เกี่ยวกับประสาทสัมผัส เรามีประสาทสัมผัสทั้งห้า: การมองเห็น การได้ยิน การลิ้มรส การสัมผัส และการดมกลิ่น ประสาทสัมผัสเหล่านี้ช่วยให้เราเข้าใจโลก เมียมองไปรอบๆ เธอเห็นต้นไม้และได้ยินเสียงนก เธอยิ้ม เมียปิดหนังสือ เธอรู้สึกมีความสุข เธอได้เรียนรู้มากมายเกี่ยวกับร่างกายของเธอ ร่างกายมนุษย์น่าทึ่งมาก! มันทำงานทุกวันโดยที่เราไม่ต้องคิด เมียตัดสินใจที่จะบอกเพื่อนๆ ของเธอเกี่ยวกับสิ่งที่เธอได้เรียนรู้ พวกเขาคงอยากรู้เรื่องร่างกายมนุษย์ด้วยเช่นกัน!"
    }
  ]
}