{
  "lesson_number": "Lesson 1",
  "lesson_title": "English: Our World Language",
  "level_name": "Level 3",
  "cefr_level": "CEFR A1+",
  "article_type": "nonfiction",
  "genre": "Language",
  "vocabulary": [
    {
      "word": "root",
      "phonetic": "",
      "definition": "The beginning or origin of something."
    },
    {
      "word": "changed",
      "phonetic": "",
      "definition": "To become different."
    },
    {
      "word": "comes from",
      "phonetic": "",
      "definition": "To originate from."
    },
    {
      "word": "countries",
      "phonetic": "",
      "definition": "A nation with its own government, occupying a particular territory."
    },
    {
      "word": "communicate",
      "phonetic": "",
      "definition": "The act of communicating with each other."
    }
  ],
  "article_image_url": "https://storage.googleapis.com/artifacts.reading-advantage.appspot.com/images/mQBtacaks53c7Djci9n6.png",
  "article_caption": "English is an old language. It comes from Europe. Now, English is a big world language. Many people use English to talk.",
  "article_url": "https://app.reading-advantage.com/th/student/read/mQBtacaks53c7Djci9n6",
  "article_paragraphs": [
    {
      "number": 1,
      "text": "English is a language. Many people speak English. It is a good language. English is old. It has a very long story. The story starts long ago. An old language is the start. This language was in North Europe. Near Germany. This old language is a root. It is a root for English. English comes from this root. Some people moved. They went to a big island. This island is Britain. In Britain, their language changed. It became Old English. Old English is very different."
    },
    {
      "number": 2,
      "text": "It is not like English today. More changes came to English. Many new words came. Words from the French language are in English. Words from the Latin language are in English too. These new words made English grow. English became bigger. Now, we speak Modern English. This English is all around. Many people speak Modern English. They are in many countries. People in America speak English. People in Australia speak English. Many schools teach English. Why is English important? It helps people. People from different countries talk. They use English."
    },
    {
      "number": 3,
      "text": "This is good. You learn English. We learn English. This helps us. English words are everywhere. 'Hello' is an English word. 'Friend' is an English word. 'Water' is an English word. English is in books. English is in songs. English is on computers. English connects the world. It is a big, helpful language. It is a world language. Many people understand English. It helps us communicate."
    }
  ],
  "comprehension_questions": [
    {
      "number": 1,
      "question": "Where was the old language?",
      "options": [
        "North Europe",
        "South America",
        "East Asia",
        "West Africa"
      ]
    },
    {
      "number": 2,
      "question": "Words from which language are in English?",
      "options": [
        "French",
        "German",
        "Spanish",
        "Italian"
      ]
    },
    {
      "number": 3,
      "question": "Do people in America speak English?",
      "options": [
        "America",
        "China",
        "Egypt",
        "Mexico"
      ]
    },
    {
      "number": 4,
      "question": "What does English do?",
      "options": [
        "Connects the world",
        "Breaks the world",
        "Hides the world",
        "Forgets the world"
      ]
    }
  ],
  "short_answer_question": "Is English old or new?",
  "sentence_starters": [
    "English is...",
    "I think...",
    "The article says..."
  ],
  "vocab_match": [
    {
      "number": 1,
      "word": "root",
      "letter": "a",
      "definition": "To originate from."
    },
    {
      "number": 2,
      "word": "changed",
      "letter": "b",
      "definition": "The beginning or origin of something."
    },
    {
      "number": 3,
      "word": "comes from",
      "letter": "c",
      "definition": "The act of communicating with each other."
    },
    {
      "number": 4,
      "word": "countries",
      "letter": "d",
      "definition": "A nation with its own government, occupying a particular territory."
    },
    {
      "number": 5,
      "word": "communicate",
      "letter": "e",
      "definition": "To become different."
    }
  ],
  "vocab_fill": [
    {
      "number": 1,
      "sentence": "This old language is a <span class=\"blank\"></span>."
    },
    {
      "number": 2,
      "sentence": "In Britain, their language <span class=\"blank\"></span>."
    },
    {
      "number": 3,
      "sentence": "English <span class=\"blank\"></span> this root."
    },
    {
      "number": 4,
      "sentence": "They are in many <span class=\"blank\"></span>."
    }
  ],
  "vocab_word_bank": [
    "root",
    "changed",
    "comes from",
    "countries",
    "communicate"
  ],
  "sentence_order_questions": [
    {
      "words": [
        "language",
        "a",
        "is",
        "English"
      ]
    },
    {
      "words": [
        "It",
        "English",
        "not",
        "like",
        "is",
        "today"
      ]
    }
  ],
  "sentence_completion_prompts": [
    {
      "number": 1,
      "prompt": "English is a"
    },
    {
      "number": 2,
      "prompt": "More changes came"
    },
    {
      "number": 3,
      "prompt": "We learn English"
    }
  ],
  "writing_prompt": "The story says English has 'friends' from other languages. Do you have friends from different places? What is your favorite thing to do with your friends? Write about it in simple sentences.",
  "mc_answers": [
    {
      "number": 1,
      "letter": "a",
      "text": "North Europe"
    },
    {
      "number": 2,
      "letter": "a",
      "text": "French"
    },
    {
      "number": 3,
      "letter": "a",
      "text": "America"
    },
    {
      "number": 4,
      "letter": "a",
      "text": "Connects the world"
    }
  ],
  "vocab_match_answer_string": "1-b, 2-e, 3-a, 4-d, 5-c",
  "vocab_fill_answer_string": "1. root, 2. changed, 3. comes from, 4. countries",
  "sentence_order_answers": [
    {
      "number": 1,
      "sentence": "English is a language."
    },
    {
      "number": 2,
      "sentence": "It is not like English today."
    }
  ],
  "translation_paragraphs": [
    {
      "label": "Paragraph 1",
      "text": "ภาษาอังกฤษเป็นภาษาหนึ่ง หลายคนพูดภาษาอังกฤษ มันเป็นภาษาที่ดี ภาษาอังกฤษเก่าแก่ มันมีเรื่องราวที่ยาวนานมาก เรื่องราวเริ่มต้นเมื่อนานมาแล้ว ภาษาเก่าเป็นจุดเริ่มต้น ภาษานี้อยู่ในยุโรปเหนือ ใกล้ประเทศเยอรมนี ภาษาเก่านี้เป็นราก มันเป็นรากสำหรับภาษาอังกฤษ ภาษาอังกฤษมาจากรากนี้ มีคนจำนวนหนึ่งย้ายถิ่นฐาน พวกเขาไปที่เกาะใหญ่ เกาะนี้คือบริเตน ในบริเตน ภาษาของพวกเขาเปลี่ยนไป มันกลายเป็นภาษาอังกฤษโบราณ ภาษาอังกฤษโบราณแตกต่างกันมาก"
    },
    {
      "label": "Paragraph 2",
      "text": "มันไม่เหมือนภาษาอังกฤษในปัจจุบัน มีการเปลี่ยนแปลงเพิ่มเติมเกิดขึ้นกับภาษาอังกฤษ 1. มีคำศัพท์ใหม่ๆ เกิดขึ้นมากมาย 2. คำศัพท์จากภาษาฝรั่งเศสอยู่ในภาษาอังกฤษ 3. คำศัพท์จากภาษาละตินก็อยู่ในภาษาอังกฤษด้วย 4. คำศัพท์ใหม่เหล่านี้ทำให้ภาษาอังกฤษเติบโต 5. ภาษาอังกฤษใหญ่ขึ้น 6. ตอนนี้เราพูดภาษาอังกฤษสมัยใหม่ 7. ภาษาอังกฤษนี้อยู่รอบตัวเรา 8. ผู้คนจำนวนมากพูดภาษาอังกฤษสมัยใหม่ 9. พวกเขาอยู่ในหลายประเทศ 10. ผู้คนในอเมริกาพูดภาษาอังกฤษ 11. ผู้คนในออสเตรเลียพูดภาษาอังกฤษ 12. โรงเรียนหลายแห่งสอนภาษาอังกฤษ 13. ทำไมภาษาอังกฤษถึงสำคัญ? 14. มันช่วยผู้คน 15. ผู้คนจากประเทศต่างๆ พูดคุยกัน 16. พวกเขาใช้ภาษาอังกฤษ"
    },
    {
      "label": "Paragraph 3",
      "text": "17. นี่เป็นสิ่งที่ดี 18. คุณเรียนภาษาอังกฤษ 19. พวกเราเรียนภาษาอังกฤษ 20. สิ่งนี้ช่วยพวกเรา คำภาษาอังกฤษมีอยู่ทุกหนทุกแห่ง 'Hello' เป็นคำภาษาอังกฤษ 'Friend' เป็นคำภาษาอังกฤษ 'Water' เป็นคำภาษาอังกฤษ ภาษาอังกฤษอยู่ในหนังสือ ภาษาอังกฤษอยู่ในเพลง ภาษาอังกฤษอยู่ในคอมพิวเตอร์ ภาษาอังกฤษเชื่อมต่อโลก มันเป็นภาษาที่ใหญ่และมีประโยชน์ มันเป็นภาษาของโลก หลายคนเข้าใจภาษาอังกฤษ มันช่วยให้เราสื่อสารกันได้"
    }
  ]
}