{
  "lesson_number": "Lesson 3",
  "lesson_title": "The Amazing Elephant",
  "level_name": "Level 3",
  "cefr_level": "CEFR A1",
  "article_type": "Informational",
  "genre": "Nature",
  "vocabulary": [
    {
      "word": "heavy",
      "phonetic": "/ˈhev.i/",
      "definition": "weighing a lot; difficult to lift"
    },
    {
      "word": "trunk",
      "phonetic": "/trʌŋk/",
      "definition": "the long nose of an elephant"
    },
    {
      "word": "forest",
      "phonetic": "/ˈfɒr.ɪst/",
      "definition": "a large place with many trees"
    },
    {
      "word": "protect",
      "phonetic": "/prəˈtekt/",
      "definition": "to keep someone or something safe"
    },
    {
      "word": "intelligent",
      "phonetic": "/ɪnˈtel.ɪ.dʒənt/",
      "definition": "smart; good at learning"
    }
  ],
  "article_image_url": "https://images.unsplash.com/photo-1557050543-4d5f4e07ef46?q=80&w=1600&auto=format&fit=crop",
  "article_caption": "An African elephant in the wild",
  "article_paragraphs": [
    {
      "number": 1,
      "text": "Elephants are the biggest land animals in the world. They are famous for their big ears and long noses. An elephant's nose is called a trunk. Elephants use their trunks to drink water and pick up food. They also use them to say hello to other elephants."
    },
    {
      "number": 2,
      "text": "Elephants are very intelligent. They have good memories and can remember places and other animals for a long time. They live in large families. The oldest female elephant is usually the leader. She shows the family where to find food and water."
    },
    {
      "number": 3,
      "text": "Sadly, elephants are in danger. People hunt them for their tusks. We need to protect these beautiful animals. Many people are working hard to save the forests where elephants live so they can be safe and happy."
    }
  ],
  "comprehension_questions": [
    {
      "number": 1,
      "question": "What is an elephant's nose called?",
      "options": [
        "a) A tusk",
        "b) A horn",
        "c) A trunk",
        "d) A tail"
      ]
    },
    {
      "number": 2,
      "question": "Who is usually the leader of an elephant family?",
      "options": [
        "a) The biggest male",
        "b) The oldest female",
        "c) The youngest baby",
        "d) The fastest runner"
      ]
    },
    {
      "number": 3,
      "question": "Why are elephants intelligent?",
      "options": [
        "a) They have good memories.",
        "b) They run very fast.",
        "c) They eat a lot of food.",
        "d) They sleep for a long time."
      ]
    },
    {
      "number": 4,
      "question": "Why are elephants in danger?",
      "options": [
        "a) They do not have enough water.",
        "b) People hunt them for their tusks.",
        "c) Other animals eat them.",
        "d) They get lost in the forest."
      ]
    }
  ],
  "short_answer_question": "Why is it important to protect elephants? Use information from the text.",
  "sentence_starters": [
    "It is important to protect elephants because...",
    "Elephants are...",
    "People should..."
  ],
  "vocab_match": [
    {
      "number": 1,
      "word": "heavy",
      "letter": "a",
      "definition": "smart"
    },
    {
      "number": 2,
      "word": "trunk",
      "letter": "b",
      "definition": "a place with many trees"
    },
    {
      "number": 3,
      "word": "forest",
      "letter": "c",
      "definition": "weighing a lot"
    },
    {
      "number": 4,
      "word": "protect",
      "letter": "d",
      "definition": "elephant's long nose"
    },
    {
      "number": 5,
      "word": "intelligent",
      "letter": "e",
      "definition": "to keep safe"
    }
  ],
  "vocab_fill": [
    {
      "number": 1,
      "sentence": "The elephant used its <span class=\"blank\"></span> to grab a peanut."
    },
    {
      "number": 2,
      "sentence": "That box is too <span class=\"blank\"></span> for me to lift."
    },
    {
      "number": 3,
      "sentence": "Monkeys and birds live in the <span class=\"blank\"></span>."
    },
    {
      "number": 4,
      "sentence": "My dog is very <span class=\"blank\"></span>; he can do tricks."
    }
  ],
  "vocab_word_bank": [
    "trunk",
    "heavy",
    "forest",
    "intelligent"
  ],
  "sentence_order_questions": [
    {
      "words": ["biggest", "are", "land", "Elephants", "animals", "the"]
    },
    {
      "words": ["have", "memories", "They", "good", "very"]
    }
  ],
  "sentence_completion_prompts": [
    {
      "number": 1,
      "prompt": "Elephants use their trunks to"
    },
    {
      "number": 2,
      "prompt": "The leader of the family helps by"
    },
    {
      "number": 3,
      "prompt": "We can help elephants by"
    }
  ],
  "writing_prompt": "What is your favorite animal? Write a short paragraph about it. Describe what it looks like, where it lives, and why you like it.",
  "mc_answers": [
    { "number": 1, "letter": "c", "text": "A trunk" },
    { "number": 2, "letter": "b", "text": "The oldest female" },
    { "number": 3, "letter": "a", "text": "They have good memories." },
    { "number": 4, "letter": "b", "text": "People hunt them for their tusks." }
  ],
  "vocab_match_answer_string": "1-c, 2-d, 3-b, 4-e, 5-a",
  "vocab_fill_answer_string": "1. trunk, 2. heavy, 3. forest, 4. intelligent",
  "sentence_order_answers": [
    { "number": 1, "sentence": "Elephants are the biggest land animals." },
    { "number": 2, "sentence": "They have very good memories." }
  ],
  "translation_paragraphs": [
    {
      "label": "Paragraph 1",
      "text": "ช้างเป็นสัตว์บกที่ใหญ่ที่สุดในโลก..."
    },
    {
      "label": "Paragraph 2",
      "text": "ช้างมีความฉลาดมาก..."
    }
  ]
}